{
  "$schema": "../schemas/item.schema.json",
  "id": "defibrillator",
  "name": "Defibrillator",
  "description": "An injection that quickly revives downed raiders and restores some health.",
  "type": "Quick Use",
  "rarity": "Rare",
  "value": 1000,
  "recyclesInto": {
    "plastic_parts": 1,
    "moss": 1
  },
  "weightKg": 0.75,
  "stackSize": 3,
  "effects": [
    {
      "label": "Healing",
      "value": 50
    },
    {
      "label": "Use Time",
      "value": "1.5s"
    }
  ],
  "imageFilename": "https://cdn.arctracker.io/items/defibrillator.png",
  "recipe": {
    "plastic_parts": 9,
    "moss": 1
  },
  "craftBench": "med_station"
}
