{
  "$schema": "../schemas/item.schema.json",
  "id": "smoke_grenade_trap",
  "name": "Smoke Grenade Trap",
  "description": "A laser trip wire that detonates a Smoke Grenade.",
  "type": "Quick Use",
  "rarity": "Rare",
  "weightKg": 0.3,
  "stackSize": 3,
  "effects": [
    {
      "label": "Duration",
      "value": "20s"
    },
    {
      "label": "Radius",
      "value": "7.5m"
    }
  ],
  "imageFilename": "https://cdn.arctracker.io/items/smoke_grenade_trap.png"
}
