{
  "$schema": "../schemas/item.schema.json",
  "id": "lure_grenade_blueprint",
  "name": "Lure Grenade Blueprint",
  "description": "A noisy device that sticks to surfaces, distracting nearby ARC machines and drawing their fire.",
  "type": "Blueprint",
  "rarity": "Legendary",
  "value": 5000,
  "weightKg": 0,
  "imageFilename": "https://cdn.arctracker.io/items/lure_grenade.png"
}
