{
  "$schema": "../schemas/item.schema.json",
  "id": "gas_grenade",
  "name": "Gas Grenade",
  "description": "A grenade that emits a lingering toxic cloud on impact, draining the stamina of any Raiders within its area of effect.",
  "type": "Quick Use",
  "rarity": "Common",
  "value": 270,
  "recyclesInto": {
    "chemicals": 1,
    "rubber_parts": 1
  },
  "weightKg": 0.2,
  "stackSize": 3,
  "effects": [
    {
      "label": "Stamina Drain",
      "value": "25/s"
    },
    {
      "label": "Duration",
      "value": "20s"
    },
    {
      "label": "Radius",
      "value": "7.5m"
    }
  ],
  "imageFilename": "https://cdn.arctracker.io/items/gas_grenade.png",
  "recipe": {
    "chemicals": 4,
    "rubber_parts": 2
  },
  "craftBench": "explosives_bench"
}
