{
  "$schema": "../schemas/item.schema.json",
  "id": "rubber_duck",
  "name": "Rubber Duck",
  "description": "Always there to lend an ear when you need it. Can be thrown to create noise.",
  "type": "Trinket",
  "rarity": "Common",
  "value": 1000,
  "recyclesInto": {},
  "weightKg": 0.3,
  "stackSize": 15,
  "imageFilename": "https://cdn.arctracker.io/items/rubber_duck.png"
}
