{
  "$schema": "../schemas/item.schema.json",
  "id": "kettle_ii",
  "name": "Kettle II",
  "description": "Semi-automatic assault rifle. Quick and accurate, but has low bullet velocity and takes a long time reload.",
  "type": "Assault Rifle",
  "rarity": "Common",
  "value": 840,
  "recyclesInto": {
    "plastic_parts": 6,
    "rubber_parts": 6
  },
  "weightKg": 7,
  "imageFilename": "https://cdn.arctracker.io/items/kettle.png"
}
