{
  "$schema": "../schemas/item.schema.json",
  "id": "blaze_grenade",
  "name": "Blaze Grenade",
  "description": "A grenade that detonates on impact, covering an area in fire that deals damage over time.",
  "type": "Quick Use",
  "rarity": "Rare",
  "value": 1600,
  "recyclesInto": {
    "oil": 2,
    "metal_parts": 4
  },
  "weightKg": 0.2,
  "stackSize": 5,
  "effects": [
    {
      "label": "Damage",
      "value": "5/s"
    },
    {
      "label": "Duration",
      "value": "10s"
    },
    {
      "label": "Radius",
      "value": "10m"
    }
  ],
  "imageFilename": "https://cdn.arctracker.io/items/blaze_grenade.png"
}
