{
  "$schema": "../schemas/item.schema.json",
  "id": "extended_shotgun_mag_iii_blueprint",
  "name": "Extended Shotgun Mag III Blueprint",
  "description": "Significantly extends the ammo capacity of shotguns.",
  "type": "Blueprint",
  "rarity": "Legendary",
  "value": 5000,
  "weightKg": 0,
  "stackSize": 1,
  "imageFilename": "https://cdn.arctracker.io/items/extended_shotgun_mag_iii.png"
}
