{
  "$schema": "../schemas/item.schema.json",
  "id": "torrente_blueprint",
  "name": "Torrente Blueprint",
  "description": "Has a large ammo capacity, but is only accurate while crouched.",
  "type": "Blueprint",
  "rarity": "Legendary",
  "value": 5000,
  "weightKg": 0,
  "imageFilename": "https://cdn.arctracker.io/items/torrente_blueprint.png"
}
