{
  "$schema": "../schemas/item.schema.json",
  "id": "vertical_grip_iii",
  "name": "Vertical Grip III",
  "description": "Significantly reduces vertical recoil. Compatible with: Tempest, Kettle, Hullcracker, Venator, Il Toro",
  "type": "Modification",
  "rarity": "Rare",
  "value": 5000,
  "weightKg": 0.75,
  "effects": [
    {
      "label": "Reduced Vertical Recoil",
      "value": "40%"
    },
    {
      "label": "Reduced ADS Speed",
      "value": "30%"
    }
  ],
  "imageFilename": "https://cdn.arctracker.io/items/vertical_grip_iii.png",
  "recipe": {
    "mod_components": 2,
    "duct_tape": 5
  },
  "craftBench": "weapon_bench"
}
