{
  "$schema": "../schemas/item.schema.json",
  "id": "first_wave_compass",
  "name": "First Wave Compass",
  "description": "Dusty but functional, these helped chart a course when all seemed lost.",
  "type": "Trinket",
  "rarity": "Common",
  "weightKg": 0.25,
  "imageFilename": "https://cdn.arctracker.io/items/first_wave_compass.png"
}
