{
  "$schema": "../schemas/item.schema.json",
  "id": "kinetic_converter",
  "name": "Kinetic Converter",
  "description": "Moderately increases fire rate. Compatible with: Arpeggio, Rattler, Kettle, Ferro, Renegade",
  "type": "Modification",
  "rarity": "Legendary",
  "value": 7000,
  "recyclesInto": {
    "mod_components": 1,
    "duct_tape": 2
  },
  "weightKg": 0.75,
  "effects": [
    {
      "label": "Increased Fire Rate",
      "value": "15%"
    },
    {
      "label": "Increased Vertical Recoil",
      "value": "20%"
    },
    {
      "label": "Increased Horizontal Recoil",
      "value": "20%"
    }
  ],
  "imageFilename": "https://cdn.arctracker.io/items/kinetic_converter.png"
}
