{
  "$schema": "../schemas/item.schema.json",
  "id": "trigger_nade_blueprint",
  "name": "Trigger Nade Blueprint",
  "description": "A remote-detonated grenade that can stick to surfaces and ARC, dealing explosive damage when triggered.",
  "type": "Blueprint",
  "rarity": "Legendary",
  "value": 5000,
  "weightKg": 0,
  "imageFilename": "https://cdn.arctracker.io/items/trigger_nade_blueprint.png"
}
