{
  "$schema": "../schemas/item.schema.json",
  "id": "free_loadout_augment",
  "name": "Free Loadout Augment",
  "description": "Basic augment for rookie Raiders, offering slightly more backpack space and carry capacity.",
  "type": "Augment",
  "rarity": "Common",
  "value": 100,
  "weightKg": 1,
  "effects": [
    {
      "label": "Durability",
      "value": 100
    }
  ],
  "imageFilename": "https://cdn.arctracker.io/items/free_loadout_augment.png"
}
