{
  "$schema": "../schemas/item.schema.json",
  "id": "zipline",
  "name": "Zipline",
  "description": "A deployable zipline that allows you to quickly move between two locations.",
  "type": "Quick Use",
  "rarity": "Rare",
  "value": 1000,
  "recyclesInto": {
    "rope": 1,
    "metal_parts": 1
  },
  "weightKg": 0.4,
  "imageFilename": "https://cdn.arctracker.io/items/zipline.png",
  "recipe": {
    "rope": 1,
    "mechanical_components": 1
  },
  "craftBench": "utility_bench"
}
