{
  "$schema": "../schemas/item.schema.json",
  "id": "lure_grenade_trap",
  "name": "Lure Grenade Trap",
  "description": "A laser trip wire that detonates a Lure Grenade.",
  "type": "Quick Use",
  "rarity": "Uncommon",
  "value": 1000,
  "weightKg": 0.25,
  "stackSize": 3,
  "effects": [
    {
      "label": "Duration",
      "value": "15s"
    },
    {
      "label": "Radius",
      "value": "50m"
    }
  ],
  "imageFilename": "https://cdn.arctracker.io/items/lure_grenade_trap.png"
}
