{
  "$schema": "../schemas/item.schema.json",
  "id": "tactical_mk3_healing",
  "name": "Tactical Mk. 3 (Healing)",
  "description": "A healing-focused augment which adds extra slots for healing items. When revived from being downed, releases a healing cloud that restores 20 health over 10 seconds. Has a 30-second cooldown.",
  "type": "Augment",
  "rarity": "Epic",
  "value": 5000,
  "recyclesInto": {
    "advanced_electrical_components": 1,
    "processor": 1
  },
  "weightKg": 4,
  "effects": [
    {
      "label": "Durability",
      "value": "100/100"
    },
    {
      "label": "Max Loadout Weight",
      "value": 55
    },
    {
      "label": "Shield Compatibility",
      "value": "Light, Medium"
    }
  ],
  "imageFilename": "https://cdn.arctracker.io/items/tactical_mk3_healing.png"
}
