{
  "$schema": "../schemas/item.schema.json",
  "id": "shotgun_choke_iii",
  "name": "Shotgun Choke III",
  "description": "Significantly reduces base dispersion.",
  "type": "Modification",
  "rarity": "Rare",
  "value": 5000,
  "weightKg": 0.75,
  "effects": [
    {
      "label": "Compatible With",
      "value": "Il Toro, Vulcano"
    },
    {
      "label": "Reduced Base Dispersion",
      "value": "30%"
    },
    {
      "label": "Increased Durability Burn Rate",
      "value": "20%"
    }
  ],
  "imageFilename": "https://cdn.arctracker.io/items/shotgun_choke_iii.png"
}
