{
  "$schema": "../schemas/item.schema.json",
  "id": "sterilized_bandage",
  "name": "Sterilized Bandage",
  "description": "A medical item that gradually restores a large amount of health over time.",
  "type": "Quick Use",
  "rarity": "Rare",
  "value": 2000,
  "weightKg": 0.2,
  "stackSize": 3,
  "effects": [
    {
      "label": "Healing",
      "value": "5/s"
    },
    {
      "label": "Duration",
      "value": "10s"
    },
    {
      "label": "Use Time",
      "value": "1.5s"
    }
  ],
  "imageFilename": "https://cdn.arctracker.io/items/sterilized_bandage.png",
  "recipe": {
    "antiseptic": 1,
    "durable_cloth": 2
  },
  "craftBench": "med_station"
}
