{
  "$schema": "../schemas/item.schema.json",
  "id": "looting_mk3_cautious",
  "name": "Looting Mk. 3 (Cautious)",
  "description": "A looting augment that swaps some carry capacity to increase survivability. Upon Shield break, automatically administers a weak Adrenaline Shot. Has a fixed cooldown.",
  "type": "Augment",
  "rarity": "Epic",
  "value": 5000,
  "weightKg": 3,
  "effects": [
    {
      "label": "Durability",
      "value": "100/100"
    },
    {
      "label": "Max Loadout Weight",
      "value": 70
    },
    {
      "label": "Shield Compatibility",
      "value": "Light"
    }
  ],
  "imageFilename": "https://cdn.arctracker.io/items/looting_mk3_cautious.png",
  "recipe": {
    "advanced_electrical_components": 2,
    "processor": 3
  },
  "craftBench": "equipment_bench"
}
