{
  "$schema": "../schemas/item.schema.json",
  "id": "shotgun_choke_i",
  "name": "Shotgun Choke I",
  "description": "Slightly reduces base dispersion. Compatible with: Il Toro, Vulcano",
  "type": "Modification",
  "rarity": "Common",
  "value": 640,
  "weightKg": 0.25,
  "effects": [
    {
      "label": "Reduced Base Dispersion",
      "value": "10%"
    }
  ],
  "imageFilename": "https://cdn.arctracker.io/items/shotgun_choke_i.png",
  "recipe": {
    "metal_parts": 6,
    "wires": 1
  },
  "craftBench": "weapon_bench"
}
