{
  "$schema": "../schemas/item.schema.json",
  "id": "vita_spray_blueprint",
  "name": "Vita Spray Blueprint",
  "description": "A medical item that continuously restores health during use. Can be used on yourself or your allies.",
  "type": "Blueprint",
  "rarity": "Legendary",
  "value": 5000,
  "imageFilename": "https://cdn.arctracker.io/items/vita_spray.png"
}
